{
  "eventType": "AGENT_ASK_USER",
  "schemaVersion": 1,
  "eventId": "7b9c0c86-4b5f-4a1f-9f6a-4b6f7d2c9a01",
  "traceId": "1c2d3e4f-0a1b-4c2d-8e3f-4a5b6c7d8e9f",
  "tripId": "9ee5e831-90f7-4a60-bb8d-fb488aa799ca",
  "runId": "5a1b2c3d-4e5f-4a6b-8c9d-0e1f2a3b4c5d",
  "occurredAt": "2026-08-29T08:30:00Z",
  "payload": {
    "question": "行程从哪天开始？",
    "options": ["2026-10-01", "2026-10-02"],
    "expectedType": "DATE"
  }
}
